word,pos,cefr,sense_id,sense_hint,sense_zipf,global_zipf_rank
expedition,noun,B2,expedition.n.01,a military campaign designed to achieve a specific objective in a foreign country,3.3172,4191
devise,verb,C1,invent.v.01,"come up with (an idea, plan, explanation, theory, or principle) after a mental effort",3.317,4192
authentic,adj,C1,authentic.s.01,conforming to fact and therefore worthy of belief,3.3166,4193
authentic,adj,C1,authentic.s.02,not counterfeit or copied,3.3166,4194
growth,noun,B1,growth.n.02,a progression from simpler to more complex forms,3.3162,4195
dip,verb,C1,dip.v.04,stain an object by immersing it in a liquid,3.3162,4196
dip,verb,C1,dip.v.03,go down momentarily,3.3162,4197
necessity,noun,B2,necessity.n.01,the condition of being essential or indispensable,3.3157,4198
preserve,verb,B2,conserve.v.02,"keep in safety and protect from harm, decay, loss, or destruction",3.3152,4199
total,verb,C1,total.v.01,add up in number or quantity,3.315,4200
shake,noun,B1,shingle.n.01,building material used as siding or roofing,3.3145,4201
immigration,noun,B2,immigration.n.01,migration into a place (especially migration to a country of which you are not a native in order to settle there),3.3145,4202
aluminum,noun,B2,aluminum.n.01,a silvery ductile metallic element found primarily in bauxite,3.3145,4203
confer,verb,C1,confer.v.01,have a conference in order to talk something over,3.3145,4204
congregation,noun,C1,congregation.n.01,a group of people who adhere to a common faith and habitually attend a given church,3.3145,4205
listing,noun,C1,list.n.01,a database containing an ordered array of items (names or topics),3.3145,4206
administer,verb,B2,administer.v.01,work in an administrative capacity; supervise or be in charge of,3.3142,4207
storm,verb,B1,ramp.v.01,"behave violently, as if in state of a great anger",3.3131,4208
diminish,verb,C1,decrease.v.01,"decrease in size, extent, or range",3.3124,4209
fraction,noun,B2,fraction.n.01,a component of a mixture that has been separated by a fractional process,3.312,4210
improvement,noun,B1,improvement.n.02,the act of improving something,3.3115,4211
improvement,noun,B1,improvement.n.01,a change for the better; progress in development,3.3115,4212
extension,noun,B2,extension.n.02,act of expanding in scope; making more widely available,3.3112,4213
applaud,verb,C1,applaud.v.01,clap one's hands or shout after performances to indicate approval,3.3112,4214
induce,verb,C1,induce.v.01,cause to arise,3.3112,4215
musical,noun,B1,musical.n.01,a play or film whose action and dialogue is interspersed with singing and dancing,3.3103,4216
greenhouse,noun,B2,greenhouse.n.01,a building with glass walls and roof; for the cultivation and exhibition of plants under controlled conditions,3.3103,4217
revenue,noun,B2,gross.n.02,the entire amount of income before any deductions are made,3.3103,4218
outlet,noun,C1,mercantile_establishment.n.01,a place of business for retailing goods,3.3103,4219
combine,verb,B1,compound.v.02,put or add together,3.3083,4220
passing,noun,C1,pass.n.03,(American football) a play that involves one player throwing the ball to a teammate,3.3081,4221
precedent,noun,C1,precedent.n.01,an example that is used to justify similar occurrences at a later time,3.3071,4222
hail,verb,C1,acclaim.v.01,praise vociferously,3.3066,4223
sustain,verb,C1,suffer.v.02,undergo (as of injuries and illnesses),3.3065,4224
resistance,noun,C1,resistance.n.02,any mechanical force that tends to retard or oppose motion,3.3064,4225
highlight,noun,B1,highlight.n.01,the most interesting or memorable part,3.306,4226
controversial,adj,B2,controversial.a.01,marked by or capable of arousing controversy,3.306,4227
interact,verb,B2,interact.v.01,act together or towards others or with others,3.306,4228
commerce,noun,C1,commerce.n.01,transactions (sales and purchases) having the objective of supplying commodities (goods and services),3.306,4229
commodity,noun,C1,commodity.n.01,articles of commerce,3.306,4230
fairness,noun,C1,fairness.n.01,conformity with rules or standards,3.306,4231
reminder,noun,C1,reminder.n.02,an experience that causes you to remember something,3.306,4232
reminder,noun,C1,reminder.n.01,a message that helps you remember something,3.306,4233
thorough,adj,C1,exhaustive.s.01,performed comprehensively and completely,3.3048,4234
interpret,verb,B2,interpret.v.01,make sense of; assign a meaning to,3.3045,4235
triumph,noun,C1,triumph.n.02,the exultation of victory,3.3036,4236
grasp,verb,C1,grok.v.01,get the meaning of something,3.3026,4237
primary,adj,B1,primary.s.02,not derived from or reducible to something else; basic,3.3022,4238
compose,verb,B2,compose.v.01,form the substance of,3.302,4239
transportation,noun,B1,transportation.n.02,the act of moving something from one location to another,3.3017,4240
presentation,noun,B1,presentation.n.03,the act of making something publicly available; presenting news or other information by broadcasting or printing it,3.3017,4241
presentation,noun,B1,presentation.n.02,a show or display; the act of presenting something to sight or view,3.3017,4242
impatient,adj,B2,impatient.a.01,restless or short-tempered under delay or opposition,3.3017,4243
impatient,adj,B2,impatient.s.02,(usually followed by `to') full of eagerness,3.3017,4244
encounter,noun,B2,brush.n.06,a minor short-term fight,3.3017,4245
enhance,verb,B2,enhance.v.02,make better or more attractive,3.3017,4246
ongoing,adj,B2,ongoing.s.01,currently happening,3.3017,4247
remarkably,adv,B2,unusually.r.01,to a remarkable degree or extent,3.3017,4248
fragile,adj,C1,fragile.s.02,vulnerably delicate,3.3017,4249
militia,noun,C1,militia.n.01,civilians trained as soldiers but not part of the regular army,3.3017,4250
shipping,noun,C1,transportation.n.05,the commercial enterprise of moving goods and materials,3.3017,4251
seemingly,adv,C1,apparently.r.01,from appearances alone; ; ; -Thomas Hardy,3.3017,4252
removal,noun,C1,removal.n.01,the act of removing,3.3017,4253
spectrum,noun,C1,spectrum.n.01,an ordered array of the components of an emission or wave,3.3012,4254
super,adj,B2,ace.s.01,of the highest quality,3.3006,4255
conventional,adj,B2,conventional.a.01,following accepted customs and proprieties,3.3003,4256
anticipate,verb,B2,expect.v.01,regard something as probable or likely,3.2999,4257
threshold,noun,C1,threshold.n.01,the starting point for a new state or experience,3.2997,4258
incorporate,verb,B2,integrate.v.01,make into a whole or make part of a whole,3.2992,4259
engagement,noun,C1,employment.n.03,the act of giving someone a job,3.2986,4260
transport,verb,B2,transport.v.02,"move while supporting, either in a vehicle or in one's hands or on one's body",3.2979,4261
enterprise,noun,C1,enterprise.n.01,a purposeful or industrious undertaking (especially one that requires effort or boldness),3.2976,4262
breathing,noun,B1,breathing.n.01,the bodily process of inhalation and exhalation; the process of taking in oxygen from inhaled air and releasing carbon dioxide by exhalation,3.2973,4263
mixture,noun,B1,mixture.n.01,(chemistry) a substance consisting of two or more substances mixed together (not in fixed proportions and not with chemical bonding),3.2973,4264
gradually,adv,B2,gradually.r.01,in a gradual manner,3.2973,4265
ideal,noun,B2,ideal.n.01,the idea of something that is perfect; something that one hopes to attain,3.2973,4266
enthusiasm,noun,B2,enthusiasm.n.03,a lively interest,3.2973,4267
enthusiasm,noun,B2,exuberance.n.02,overflowing with eager enjoyment or approval,3.2973,4268
habitat,noun,B2,habitat.n.01,the type of environment in which an organism or group normally lives or occurs,3.2973,4269
participation,noun,B2,engagement.n.07,the act of sharing in the activities of a group,3.2973,4270
survivor,noun,B2,survivor.n.02,one who outlives another,3.2973,4271
attribute,verb,C1,impute.v.01,attribute or credit to,3.2973,4272
confrontation,noun,C1,confrontation.n.01,a bold challenge,3.2973,4273
desirable,adj,C1,desirable.a.01,worth having or seeking or achieving,3.2973,4274
driving,adj,C1,driving.s.01,having the power of driving or impelling,3.2973,4275
guerrilla,noun,C1,guerrilla.n.01,a member of an irregular armed force that fights a stronger force by sabotage and harassment,3.2973,4276
tension,noun,B2,tension.n.02,the physical condition of being stretched or strained,3.2968,4277
printing,noun,B1,printing.n.01,text handwritten in the style of printed matter,3.2958,4278
drift,verb,C1,stray.v.02,wander from a direct course or at random,3.2949,4279
awareness,noun,B2,awareness.n.01,having knowledge of,3.2944,4280
movement,noun,A2,motion.n.06,the act of changing location from one place to another,3.2942,4281
withdraw,verb,B2,disengage.v.01,"release from something that holds fast, connects, or entangles",3.2934,4282
withdraw,verb,B2,retire.v.02,withdraw from active participation,3.2934,4283
nod,verb,C1,nod.v.01,express or signify by nodding,3.2931,4284
gap,noun,A2,gap.n.01,a conspicuous disparity or difference as between two figures,3.2929,4285
consume,verb,B1,devour.v.03,eat immoderately,3.2929,4286
consume,verb,B1,consume.v.02,"serve oneself to, or consume regularly",3.2929,4287
highlight,verb,B1,foreground.v.01,move into the foreground to make more visible or prominent,3.2929,4288
prediction,noun,B1,prediction.n.01,the act of predicting (as by reasoning about the future),3.2929,4289
motor,adj,B2,centrifugal.s.03,conveying information to the muscles from the CNS,3.2929,4290
economics,noun,B2,economics.n.01,the branch of social science that deals with the production and distribution and consumption of goods and services and their management,3.2929,4291
guideline,noun,B2,guideline.n.01,a light line that is used in lettering to help align the letters,3.2929,4292
logo,noun,B2,logo.n.01,a company emblem or device,3.2929,4293
blend,verb,C1,blend.v.01,combine into one,3.2929,4294
feat,noun,C1,feat.n.01,a notable achievement,3.2929,4295
supreme,adj,C1,supreme.s.01,final or last in your life or progress,3.2929,4296
reign,noun,C1,reign.n.01,a period during which something or somebody is dominant or powerful,3.2929,4297
assurance,noun,C1,assurance.n.01,freedom from doubt; belief in yourself and your abilities,3.2923,4298
dispose,verb,C1,discard.v.01,throw or cast away,3.2923,4299
dispose,verb,C1,dispose.v.01,"give, sell, or transfer to another",3.2923,4300
top,noun,A2,top.n.02,the highest or uppermost side of anything,3.2916,4301
instantly,adv,B2,instantaneously.r.01,without any delay,3.2916,4302
ward,noun,C1,ward.n.01,a person who is under the protection or in the custody of another,3.2907,4303
slide,noun,B2,swoop.n.01,(music) rapid sliding up or down the musical scale,3.2899,4304
slide,noun,B2,slide.n.04,plaything consisting of a sloping chute down which children can slide,3.2899,4305
casual,adj,B2,casual.s.03,appropriate for ordinary or routine occasions,3.2891,4306
pass,noun,B1,pass.n.03,(American football) a play that involves one player throwing the ball to a teammate,3.2887,4307
provision,noun,C1,provision.n.01,a stipulated condition,3.2886,4308
focus,noun,A2,focus.n.01,the concentration of attention or energy on something,3.2884,4309
loud,adv,A2,loudly.r.01,with relatively high volume,3.2884,4310
survey,noun,B1,survey.n.01,a detailed critical inspection,3.2884,4311
enjoyable,adj,B2,enjoyable.s.01,affording satisfaction or pleasure,3.2884,4312
deprive,verb,C1,deprive.v.02,"keep from having, keeping, or obtaining",3.2884,4313
deprive,verb,C1,deprive.v.01,take away possessions from someone,3.2884,4314
commentator,noun,C1,observer.n.02,an expert who observes and comments on something,3.2884,4315
prosperity,noun,C1,prosperity.n.01,an economic state of growth with rising profits and full employment,3.2884,4316
transformation,noun,C1,transformation.n.01,a qualitative change,3.2884,4317
overlook,verb,C1,look_out_on.v.01,be oriented in a certain direction,3.288,4318
interference,noun,C1,intervention.n.02,a policy of intervening in the affairs of other countries,3.2878,4319
eastern,adj,B1,eastern.s.01,lying toward or situated in the east,3.2873,4320
functional,adj,C1,functional.a.01,designed for or capable of a particular function or use,3.2873,4321
imprison,verb,C1,imprison.v.01,"lock up or confine, in or as in a jail",3.2873,4322
render,verb,C1,supply.v.01,give something useful or necessary to,3.287,4323
prompt,verb,B2,motivate.v.01,give an incentive for action,3.2864,4324
operational,adj,C1,operational.a.01,pertaining to a process or series of actions for achieving a result,3.2862,4325
spread,verb,B1,spread.v.02,become distributed or widespread,3.2861,4326
spread,verb,B1,spread.v.03,spread across or over,3.2861,4327
spiritual,adj,B2,religious.s.01,concerned with sacred matters or religion or the church,3.286,4328
advance,verb,B2,boost.v.04,increase or raise,3.2857,4329
criticism,noun,B2,criticism.n.01,disapproval expressed by pointing out faults or shortcomings,3.2839,4330
genuinely,adv,B2,truly.r.01,in accordance with truth or fact or reality,3.2839,4331
shortage,noun,C1,deficit.n.01,the property of being an amount by which something is less than expected or required,3.2839,4332
creator,noun,C1,godhead.n.01,terms referring to the Judeo-Christian God,3.2839,4333
parental,adj,C1,parental.a.01,designating the generation of organisms from which hybrid offspring are produced,3.2839,4334
adequate,adj,B2,adequate.a.01,having the requisite qualities or resources to meet a task,3.2818,4335
hollow,adj,B2,hollow.a.01,not solid; having a space or gap or cavity,3.2817,4336
hollow,adj,B2,empty.s.02,devoid of significance or point,3.2817,4337
caution,noun,C1,caution.n.02,a warning against certain acts,3.2817,4338
clarity,noun,C1,clarity.n.01,free from obscurity and easy to understand; the comprehensibility of clear expression,3.2812,4339
productive,adj,C1,productive.a.01,producing or capable of producing (especially abundantly),3.2803,4340
adult,adj,A2,adult.s.01,(of animals) fully developed,3.2794,4341
complicated,adj,B1,complicated.s.01,difficult to analyze or understand,3.2794,4342
curve,noun,B2,curve.n.02,a line on a graph representing data,3.2794,4343
perception,noun,B2,percept.n.01,the representation of what is perceived; basic component in the formation of a concept,3.2794,4344
voluntary,adj,B2,voluntary.a.01,of your own free will or design; done by choice; not forced or compelled,3.2794,4345
endorsement,noun,C1,endorsement.n.01,a promotional statement (as found on the dust jackets of books),3.2794,4346
intersection,noun,C1,intersection.n.01,a point where lines intersect,3.2794,4347
outbreak,noun,C1,outbreak.n.01,a sudden violent spontaneous occurrence (usually of some undesirable condition),3.2794,4348
suburban,adj,C1,suburban.a.01,relating to or characteristic of or situated in suburbs,3.2794,4349
slash,verb,C1,slash.v.01,cut with sweeping strokes; as with an ax or machete,3.2794,4350
dark,noun,A2,night.n.01,the time after sunset and before sunrise while it is dark outside,3.2791,4351
interpretation,noun,B2,interpretation.n.01,a mental representation of the meaning or significance of something,3.2788,4352
residue,noun,C1,residue.n.01,matter that remains after something has been removed,3.2779,4353
trend,noun,B2,tendency.n.04,a general direction in which something tends to move,3.2771,4354
determination,noun,B2,determination.n.01,"the act of determining the properties of something, usually by research or calculation",3.2771,4355
reform,noun,C1,reform.n.01,a change for the better as a result of correcting abuses,3.2771,4356
suffering,noun,B2,agony.n.02,a state of acute pain,3.2767,4357
severe,adj,B2,hard.s.04,very strong or vigorous,3.2751,4358
acquisition,noun,B2,acquisition.n.01,the act of contracting or assuming or acquiring possession of something,3.2748,4359
stance,noun,B2,stance.n.01,standing posture,3.2748,4360
extend,verb,B2,cover.v.03,"span an interval of distance, space or time",3.2747,4361
depression,noun,B2,depression.n.02,a long-term economic state characterized by unemployment and low prices and low levels of trade and investment,3.2743,4362
boost,verb,B2,hike.v.01,increase,3.2741,4363
insert,verb,B2,insert.v.01,put or introduce into something,3.2724,4364
folding,adj,B2,foldable.s.01,capable of being folded up and stored,3.2702,4365
electronics,noun,B2,electronics.n.01,the branch of physics that deals with the emission and effects of electrons and with the use of electronic devices,3.2702,4366
frequent,adj,B2,frequent.a.01,coming at short intervals or habitually,3.2702,4367
gaming,noun,B2,gambling.n.01,the act of playing for stakes in the hope of winning (including the payment of a price for a chance to win a prize),3.2702,4368
teen,noun,B2,adolescent.n.01,a juvenile between the onset of puberty and maturity,3.2702,4369
cluster,noun,C1,bunch.n.01,a grouping of a number of similar things,3.2702,4370
embed,verb,C1,implant.v.01,fix or set securely or deeply,3.2702,4371
glance,verb,C1,glance.v.01,throw a glance at; take a brief look at,3.2697,4372
clause,noun,B1,clause.n.01,(grammar) an expression including a subject and predicate but not constituting a complete sentence,3.2686,4373
neglect,verb,C1,neglect.v.01,leave undone or leave out,3.2686,4374
leadership,noun,B2,leadership.n.01,the activity of leading,3.2676,4375
free,verb,B2,dislodge.v.01,remove or force out from a position,3.2672,4376
stamp,noun,B1,stamp.n.03,a symbol that is the result of printing or engraving,3.2655,4377
stamp,noun,B1,stamp.n.02,a type or class,3.2655,4378
stamp,noun,B1,cast.n.03,the distinctive form in which a thing is made,3.2655,4379
icon,noun,B2,icon.n.01,(computer science) a graphic symbol (usually a simple picture) that denotes a program or a command or a data file or a concept in a graphical user interface,3.2655,4380
compelling,adj,C1,compelling.s.01,driving or forcing,3.2655,4381
discharge,verb,C1,discharge.v.02,pour forth or release,3.265,4382
discharge,verb,C1,dispatch.v.02,complete or carry out,3.265,4383
mate,verb,B2,copulate.v.01,engage in sexual intercourse,3.2649,4384
suppress,verb,C1,suppress.v.01,to put down by force or authority,3.2645,4385
pace,noun,B2,footstep.n.03,the distance covered by a step,3.264,4386
explosive,adj,C1,explosive.a.01,serving to explode or characterized by explosion or sudden outburst,3.2636,4387
atmosphere,noun,B1,atmosphere.n.03,the mass of air surrounding the Earth,3.2635,4388
merge,verb,C1,unify.v.01,become one,3.2633,4389
encounter,verb,B2,find.v.01,"come upon, as if by accident; meet with",3.2621,4390
dependent,adj,B2,dependent.a.01,"relying on or requiring a person or thing for support, supply, or what is needed",3.2617,4391
expire,verb,C1,die.v.01,pass from physical life and lose all bodily attributes and functions necessary to sustain life,3.2617,4392
component,noun,B1,component.n.01,an abstract part of something,3.2616,4393
outside,adj,A2,outside.a.01,relating to or being on or near the outer side or limit,3.2609,4394
outside,adj,A2,external.s.02,coming from the outside,3.2609,4395
essential,adj,B1,essential.s.01,absolutely necessary; vitally necessary,3.2607,4396
tax,verb,B1,tax.v.01,levy a tax on,3.2607,4397
dynamic,adj,B2,dynamic.a.01,characterized by action or forcefulness or force of personality,3.2607,4398
forecast,noun,B2,prognosis.n.01,a prediction about how something (as the weather) will develop,3.2607,4399
advocate,noun,B2,advocate.n.01,a person who pleads for a cause or propounds an idea,3.2607,4400
competent,adj,C1,competent.a.01,properly or sufficiently qualified or capable or efficient,3.2607,4401
breakthrough,noun,C1,discovery.n.03,a productive insight,3.2607,4402
breakthrough,noun,C1,breakthrough.n.02,making an important discovery,3.2607,4403
reasoning,noun,C1,reasoning.n.01,thinking that is coherent and logical,3.2607,4404
expand,verb,B1,expand.v.02,become larger in size or volume or quantity,3.2595,4405
original,noun,B1,master.n.06,"an original creation (i.e., an audio recording) from which copies can be made",3.2588,4406
seize,verb,C1,seize.v.02,take or capture by force,3.2585,4407
liable,adj,C1,liable.s.03,(often followed by `to') likely to be affected with,3.2583,4408
specialize,verb,B2,specialize.v.01,become more focus on an area of activity or field of study,3.258,4409
employment,noun,B1,employment.n.02,the occupation for which you are paid,3.2577,4410
employment,noun,B1,employment.n.01,the state of being employed or having a job,3.2577,4411
inadequate,adj,C1,inadequate.a.01,lacking the requisite qualities or resources to meet a task,3.2559,4412
span,noun,C1,span.n.01,the complete duration of something,3.2559,4413
tribal,adj,C1,tribal.a.01,relating to or characteristic of a tribe,3.2559,4414
submit,verb,B2,submit.v.02,put before,3.2548,4415
legitimate,adj,C1,legitimate.a.01,of marriages and offspring; recognized as lawful,3.2547,4416
legitimate,adj,C1,lawful.s.04,"authorized, sanctioned by, or in accordance with law",3.2547,4417
legitimate,adj,C1,legitimate.s.03,in accordance with recognized or accepted standards or principles,3.2547,4418
depart,verb,B2,deviate.v.02,be at variance with; be out of line with,3.2546,4419
lost,adj,A2,confused.s.03,having lost your bearings; confused as to time or place or personal identity,3.2543,4420
lost,adj,A2,lost.a.01,no longer in your possession or control; unable to be found or recovered,3.2543,4421
passage,noun,B2,passage.n.02,a section of text; particularly a section of medium length,3.254,4422
toll,noun,C1,toll.n.01,a fee levied for the use of roads or bridges (used for maintenance),3.2535,4423
toll,noun,C1,price.n.03,value measured by what must be given or done or undergone to obtain something,3.2535,4424
greet,verb,A2,greet.v.02,send greetings to,3.253,4425
domain,noun,C1,sphere.n.01,a particular environment or walk of life,3.2527,4426
hopeful,adj,C1,hopeful.a.01,having or manifesting hope,3.2527,4427
increasingly,adv,B2,increasingly.r.01,advancing in amount or intensity,3.2511,4428
fossil,noun,B2,dodo.n.01,someone whose style is out of fashion,3.2511,4429
solely,adv,C1,entirely.r.02,without any others being included or involved,3.2511,4430
venture,noun,C1,venture.n.01,any venturesome undertaking especially one with an uncertain outcome,3.2511,4431
fundamental,adj,B2,cardinal.s.01,serving as an essential component,3.2505,4432
educational,adj,B1,educational.a.01,relating to the process of education,3.2501,4433
assembly,noun,C1,fabrication.n.04,the act of constructing something (as a piece of machinery),3.2497,4434
assembly,noun,C1,assembly.n.01,a group of machine parts that fit together to form a self-contained unit,3.2497,4435
signal,verb,B1,bespeak.v.01,be a signal for or a symptom of,3.2476,4436
reflect,verb,B1,reflect.v.03,to throw or bend back (from a surface),3.2463,4437
washing,noun,B1,wash.n.02,the work of cleansing (usually with soap and water),3.2462,4438
currency,noun,B1,currency.n.02,general acceptance or use,3.2462,4439
currency,noun,B1,currency.n.01,the metal or paper medium of exchange that is presently used,3.2462,4440
knock,noun,B1,knock.n.01,the sound of knocking (as on a door or in an engine or bearing),3.2462,4441
written,adj,B1,written.a.01,set down in writing in any of various ways,3.2462,4442
absorb,verb,B2,absorb.v.01,become imbued,3.2462,4443
creativity,noun,B2,creativity.n.01,the ability to create,3.2462,4444
incorrect,adj,B2,incorrect.a.01,not correct; not in conformity with fact or truth,3.2462,4445
premium,noun,C1,premium.n.01,payment for insurance,3.2462,4446
radical,adj,C1,revolutionary.s.01,markedly new or introducing radical change,3.2462,4447
stability,noun,C1,stability.n.01,the quality or attribute of being firm and steadfast,3.2462,4448
upgrade,verb,C1,upgrade.v.01,rate higher; raise in value or esteem,3.2462,4449
convey,verb,B2,convey.v.01,"make known; pass on, of information",3.2456,4450
merit,noun,C1,deservingness.n.01,"the quality of being deserving (e.g., deserving assistance)",3.2455,4451
reference,noun,B1,reference_point.n.01,an indicator that orients you generally,3.243,4452
reference,noun,B1,reference_book.n.01,a book to which you can refer for authoritative facts,3.243,4453
mass,noun,B2,mass.n.04,(Roman Catholic Church and Protestant Churches) the celebration of the Eucharist,3.2429,4454
verse,noun,C1,verse.n.02,a piece of poetry,3.2429,4455
verse,noun,C1,verse.n.03,a line of metrical text,3.2429,4456
please,verb,A2,please.v.02,be the will of or have the will (to),3.2422,4457
barrier,noun,B1,barrier.n.01,a structure or object that impedes free movement,3.2418,4458
stretch,noun,B2,stretch.n.03,a straightaway section of a racetrack,3.2418,4459
stretch,noun,B2,stretch.n.04,exercise designed to extend the limbs and muscles to their full extent,3.2418,4460
introduction,noun,A2,introduction.n.02,the first section of a communication,3.2412,4461
introduction,noun,A2,introduction.n.01,the act of beginning something new,3.2412,4462
fashionable,adj,B1,fashionable.a.01,being or in accordance with current social fashions,3.2412,4463
similarity,noun,B1,similarity.n.01,the quality of being similar,3.2412,4464
aspiration,noun,C1,aspiration.n.01,a will to succeed,3.2412,4465
exclusively,adv,C1,entirely.r.02,without any others being included or involved,3.2412,4466
offspring,noun,C1,offspring.n.01,the immediate descendants of a person,3.2412,4467
renowned,adj,C1,celebrated.s.01,widely known and esteemed,3.2412,4468
surplus,noun,C1,excess.n.01,a quantity much larger than is needed,3.2412,4469
undertake,verb,B2,undertake.v.01,enter upon an activity or enterprise,3.2409,4470
quantity,noun,A2,measure.n.02,how much there is or how many there are of something that you can quantify,3.2395,4471
mount,verb,B2,wax.v.02,go up or advance,3.2391,4472
educate,verb,B1,educate.v.01,give an education to,3.2389,4473
layout,noun,C1,layout.n.01,a plan or design of something that is laid out,3.2387,4474
layout,noun,C1,layout.n.02,the act of laying out (as by making plans for something),3.2387,4475
replacement,noun,C1,surrogate.n.01,someone who takes the place of another person,3.2384,4476
