word,pos,cefr,sense_id,sense_hint,sense_zipf,global_zipf_rank
heavily,adv,B1,heavily.r.01,to a considerable degree,3.7069,2779
slot,noun,C1,slot.n.01,a position in a grammatical linguistic construction in which a variety of alternative units are interchangeable,3.7069,2780
phenomenon,noun,B2,phenomenon.n.01,any state or process known through the senses rather than by intuition or reasoning,3.7068,2781
driving,noun,A2,drive.n.06,hitting a golf ball off of a tee with a driver,3.7065,2782
lethal,adj,C1,deadly.s.02,of an instrument of certain death,3.7065,2783
regardless,adv,C1,regardless.r.01,in spite of everything; without regard to drawbacks,3.7065,2784
gentle,adj,B1,gentle.s.01,soft and mild; not harsh or stern or severe,3.7059,2785
welfare,noun,B2,social_welfare.n.01,governmental provision of economic assistance to persons in need,3.7057,2786
youth,noun,B1,young_person.n.01,a young person (especially a young man or boy),3.7054,2787
dark,noun,A2,dark.n.01,absence of light or illumination,3.7051,2788
link,noun,A2,link.n.02,a fastener that serves to join or connect,3.7048,2789
link,noun,A2,link.n.01,the means of connection between things linked in series,3.7048,2790
criticize,verb,B2,knock.v.06,find fault with; express criticism of; point out real or perceived flaws,3.7048,2791
imply,verb,B2,imply.v.01,express or state indirectly,3.7046,2792
hint,noun,C1,hint.n.02,a slight indication,3.7039,2793
hint,noun,C1,hint.n.01,an indirect suggestion,3.7039,2794
spy,verb,C1,descry.v.01,catch sight of,3.7039,2795
spy,verb,C1,spy.v.02,"watch, observe, or inquire secretly",3.7039,2796
central,adj,B1,cardinal.s.01,serving as an essential component,3.7037,2797
following,adj,A2,following.a.03,going or proceeding or coming after in the same direction,3.7031,2798
error,noun,A2,mistake.n.01,a wrong action attributable to bad judgment or ignorance or inattention,3.7031,2799
negotiation,noun,B2,negotiation.n.01,a discussion intended to produce an agreement,3.7031,2800
demonstration,noun,B2,presentation.n.02,a show or display; the act of presenting something to sight or view,3.7025,2801
guard,verb,B1,guard.v.01,to keep watch over,3.7023,2802
plot,noun,B1,plot.n.01,a secret scheme to do something (especially something underhand or illegal),3.7015,2803
flying,adj,A2,fast-flying.s.01,moving swiftly,3.7014,2804
research,verb,A2,research.v.01,attempt to find out in a systematically and scientific manner,3.7014,2805
phase,noun,B2,phase.n.01,any distinct time period in a sequence of events,3.7009,2806
assign,verb,B2,delegate.v.02,"give an assignment to (a person) to a post, or assign a task to (a person)",3.7008,2807
assign,verb,B2,assign.v.02,give out,3.7008,2808
craft,noun,B2,trade.n.02,the skilled practice of a practical occupation,3.7005,2809
purely,adv,B2,strictly.r.01,restricted to something,3.6996,2810
legacy,noun,C1,bequest.n.01,(law) a gift of personal property by will,3.6996,2811
snap,verb,C1,snap.v.01,"utter in an angry, sharp, or abrupt tone",3.6992,2812
strip,verb,C1,deprive.v.01,take away possessions from someone,3.699,2813
echo,verb,C1,repeat.v.04,to say again or imitate,3.6984,2814
challenge,verb,B1,challenge.v.02,issue a challenge to,3.6982,2815
investment,noun,B2,investment.n.02,money that is invested with an expectation of profit,3.6967,2816
mode,noun,B2,manner.n.01,how something is done or how it happens,3.6961,2817
seminar,noun,C1,seminar.n.01,any meeting for an exchange of ideas,3.6961,2818
patch,noun,B2,spot.n.05,a small contrasting part of something,3.6953,2819
seal,verb,C1,seal.v.02,close with or as if with a seal,3.6953,2820
seal,verb,C1,seal.v.01,make tight; secure against leakage,3.6953,2821
free,adv,A2,loose.r.01,without restraint,3.6944,2822
traveler,noun,B1,traveler.n.01,a person who changes location,3.6944,2823
promising,adj,B2,promising.s.01,showing possibility of achievement or excellence,3.6931,2824
carbon,noun,B2,carbon.n.01,an abundant nonmetallic tetravalent element occurring in three allotropic forms: amorphous carbon and graphite and diamond; occurs in all organic compounds,3.6926,2825
deploy,verb,C1,deploy.v.01,place troops or weapons in battle formation,3.6926,2826
violation,noun,C1,misdemeanor.n.01,a crime less serious than a felony,3.6926,2827
disappointment,noun,B2,disappointment.n.01,a feeling of dissatisfaction that results when your expectations are not realized,3.6923,2828
figure,noun,A2,digit.n.01,one of the elements that collectively form a system of numeration,3.6915,2829
radiation,noun,B2,radiation.n.01,energy that is radiated or transmitted in the form of rays or waves or particles,3.6914,2830
chairman,noun,B1,president.n.04,the officer who presides at the meetings of an organization,3.6908,2831
accompany,verb,B2,attach_to.v.01,be present or associated with an event or entity,3.6908,2832
sufficient,adj,B2,sufficient.a.01,of a quantity that can fulfill a need or requirement but without being abundant,3.6908,2833
liter,noun,C1,liter.n.01,"a metric unit of capacity, formerly defined as the volume of one kilogram of pure water under standard conditions; now equal to 1,000 cubic centimeters (or approximately 1.75 pints)",3.6908,2834
ironic,adj,C1,dry.s.02,humorously sarcastic or mocking,3.6908,2835
sole,adj,C1,exclusive.s.01,not divided or shared with others,3.6908,2836
absence,noun,C1,absence.n.01,the state of being absent,3.6906,2837
journal,noun,B1,diary.n.01,a daily written record of (usually personal) experiences and observations,3.6903,2838
fabric,noun,B2,fabric.n.01,artifact made by weaving or felting or knitting or crocheting natural or synthetic fibers,3.69,2839
psychological,adj,B2,psychological.s.01,mental or emotional as opposed to physical in nature,3.69,2840
communicate,verb,A2,communicate.v.02,transmit thoughts or feelings,3.6895,2841
equal,verb,B1,equal.v.01,be identical or equivalent to,3.6894,2842
launch,noun,B2,launch.n.01,a motorboat with an open deck or a half deck,3.6891,2843
grace,noun,C1,grace.n.01,(Christian theology) a state of sanctification by God; the state of one who is under such divine influence,3.6891,2844
grace,noun,C1,grace.n.02,elegance and beauty of movement or expression,3.6891,2845
embrace,verb,B2,embrace.v.01,include in scope; include as part of something broader; have as one's sphere or territory,3.6889,2846
bow,noun,C1,bow.n.01,a knot with two loops and loose ends; used to tie shoelaces,3.6882,2847
leap,verb,C1,jump.v.01,move forward by leaps and bounds,3.6881,2848
worry,noun,B1,worry.n.02,a strong feeling of anxiety,3.688,2849
vein,noun,C1,vein.n.01,a blood vessel that carries blood from the capillaries toward the heart,3.6878,2850
tackle,verb,B2,undertake.v.02,accept as a challenge,3.6873,2851
shocking,adj,C1,lurid.s.02,glaringly vivid and graphic; marked by sensationalism,3.6873,2852
irrelevant,adj,C1,irrelevant.a.01,having no bearing on or connection with the subject at issue,3.6873,2853
solo,noun,C1,solo.n.01,any activity that is performed alone without assistance,3.6873,2854
connect,verb,A2,connect.v.04,join by means of communication equipment,3.6865,2855
endless,adj,C1,endless.s.01,tiresomely long; seemingly without end,3.6864,2856
suspend,verb,B2,suspend.v.01,hang freely,3.6861,2857
handy,adj,C1,handy.s.01,easy to reach,3.6855,2858
handy,adj,C1,handy.s.02,easy to use,3.6855,2859
stream,noun,B2,stream.n.01,a natural body of running water flowing on or under the earth,3.6838,2860
website,noun,A2,web_site.n.01,a computer connected to the internet that maintains a series of web pages on the World Wide Web,3.6837,2861
offender,noun,B2,wrongdoer.n.01,a person who transgresses moral or civil law,3.6837,2862
principle,noun,B2,principle.n.01,a basic generalization that is accepted as true and that can be used as a basis for reasoning or conduct,3.6828,2863
flying,noun,A2,flight.n.02,an instance of traveling by air,3.6819,2864
evolution,noun,B2,development.n.02,a process in which something passes by degrees to a different stage (especially a more advanced or mature stage),3.6819,2865
permanently,adv,B2,permanently.r.01,for a long time without essential change,3.6819,2866
academy,noun,C1,academy.n.01,a secondary school (usually private),3.6819,2867
rational,adj,C1,rational.a.01,consistent with or based on or using reason,3.6819,2868
minor,adj,B2,minor.a.01,of lesser importance or stature or rank,3.6811,2869
crash,verb,B2,crash.v.02,"move with, or as if with, a crashing noise",3.6808,2870
disturb,verb,B2,agitate.v.06,change the arrangement or position of,3.6803,2871
collapse,verb,B1,break_down.v.08,"collapse due to fatigue, an illness, or a sudden attack",3.6802,2872
motivate,verb,B2,motivate.v.01,give an incentive for action,3.6801,2873
flaw,noun,C1,defect.n.03,an imperfection in an object or machine,3.6801,2874
broad,adj,B2,across-the-board.s.01,broad in scope or content; ; ; ; ; - T.G.Winner,3.6799,2875
tap,verb,B2,tap.v.02,draw from or dip into to get something,3.6792,2876
tap,verb,B2,tap.v.03,strike lightly,3.6792,2877
rest,verb,A2,rest.v.03,give a rest to,3.679,2878
float,verb,B2,float.v.02,be afloat either on or below a liquid surface and not sink to the bottom,3.679,2879
horror,noun,B1,horror.n.01,intense and profound fear,3.6783,2880
calculate,verb,B2,calculate.v.01,make a mathematical calculation or computation,3.6783,2881
detain,verb,C1,confine.v.05,deprive of freedom; take into confinement,3.6783,2882
devastate,verb,C1,lay_waste_to.v.01,cause extensive destruction or ruin utterly,3.6783,2883
marine,adj,C1,marine.a.01,of or relating to the sea,3.6783,2884
overwhelming,adj,C1,overpowering.s.01,so strong as to be irresistible,3.6783,2885
tactical,adj,C1,tactical.a.01,of or pertaining to tactic or tactics,3.6783,2886
treaty,noun,C1,treaty.n.01,a written agreement between two states or sovereigns,3.6783,2887
utterly,adv,C1,absolutely.r.01,completely and without qualification; used informally as intensifiers,3.6783,2888
increase,verb,A2,increase.v.02,make bigger or more,3.6776,2889
precise,adj,B2,precise.a.01,sharply exact or accurate or delimited,3.6768,2890
sink,verb,B1,sink.v.02,cause to sink,3.6767,2891
sink,verb,B1,sink.v.01,fall or descend to a lower place or level,3.6767,2892
embassy,noun,C1,embassy.n.01,a diplomatic building where ambassadors live or work,3.6764,2893
toxic,adj,C1,toxic.a.01,of or relating to or caused by a toxin or poison,3.6764,2894
review,verb,A2,review.v.01,look at again; examine again,3.6759,2895
leave,noun,B2,leave.n.01,the period of time during which you are absent from work or duty,3.6758,2896
loose,adj,B2,loose.a.03,not tight; not closely constrained or constricted or constricting,3.6757,2897
maximum,noun,B2,maximum.n.01,the largest possible quantity,3.6755,2898
custom,noun,B1,custom.n.02,a specific practice of long standing,3.6749,2899
suitable,adj,B1,suitable.s.01,meant or adapted for an occasion or use,3.6746,2900
amateur,adj,B2,amateur.s.01,engaged in as a pastime,3.6746,2901
burial,noun,C1,burial.n.01,the ritual placing of a corpse in a grave,3.6746,2902
commissioner,noun,C1,commissioner.n.01,a government administrator,3.6746,2903
dose,noun,C1,dose.n.01,a measured portion of medicine taken at any one time,3.6746,2904
syndrome,noun,C1,syndrome.n.01,a complex of concurrent things,3.6746,2905
distinguish,verb,B2,distinguish.v.01,mark as different,3.6735,2906
present,verb,A2,stage.v.01,"perform (a play), especially on a stage",3.6733,2907
conscious,adj,B1,conscious.s.01,intentionally conceived,3.6733,2908
literature,noun,B1,literature.n.01,creative writing of recognized artistic value,3.6729,2909
philosophy,noun,B2,doctrine.n.01,a belief (or system of beliefs) accepted as authoritative by some group or school,3.6728,2910
mild,adj,B1,mild.a.01,moderate in type or degree or effect or force; far from extreme,3.6727,2911
spread,noun,B2,spread.n.01,process or result of distributing or extending over a wide expanse of space,3.6727,2912
spread,noun,B2,gap.n.01,a conspicuous disparity or difference as between two figures,3.6727,2913
metaphor,noun,B2,metaphor.n.01,a figure of speech in which an expression is used to refer to something that it does not literally denote in order to suggest a similarity,3.6727,2914
wheat,noun,B2,wheat.n.01,annual or biennial grass having erect flower spikes and light brown grains,3.6727,2915
commitment,noun,B1,committedness.n.01,the trait of sincere and steadfast fixity of purpose,3.6724,2916
commitment,noun,B1,commitment.n.02,the act of binding yourself (intellectually or emotionally) to a course of action,3.6724,2917
counter,verb,C1,counter.v.01,speak in response,3.6721,2918
vicious,adj,C1,barbarous.s.01,(of persons or their actions) able or disposed to inflict pain or suffering,3.672,2919
passion,noun,B1,mania.n.01,an irrational but irresistible motive for a belief or action,3.6718,2920
passion,noun,B1,love.n.02,any object of warm affection or devotion,3.6718,2921
passion,noun,B1,passion.n.05,a feeling of strong sexual desire,3.6718,2922
adoption,noun,B2,adoption.n.01,the act of accepting with approval; favorable reception,3.6709,2923
interior,adj,C1,interior.a.01,situated within or suitable for inside a building,3.6709,2924
episode,noun,B1,episode.n.02,a brief section of a literary or dramatic work that forms part of a connected series,3.6701,2925
associate,verb,B1,associate.v.01,make a logical or causal connection,3.6686,2926
appeal,verb,B1,appeal.v.01,take a court case to a higher court for review,3.6672,2927
quality,noun,A2,quality.n.02,a degree or grade of excellence or worth,3.6669,2928
equally,adv,B1,equally.r.01,to the same degree (often followed by `as'),3.6669,2929
ally,noun,B2,ally.n.01,a friendly nation,3.6667,2930
strip,noun,C1,strip.n.01,a relatively long narrow piece of something,3.6656,2931
bind,verb,C1,bind.v.03,"make fast; tie or secure, with or as if with a rope",3.6655,2932
global,adj,B1,global.s.01,involving the entire earth; not limited or provincial in scope,3.6653,2933
make,noun,B2,brand.n.02,a recognizable kind,3.6653,2934
dam,noun,C1,dam.n.01,a barrier constructed to contain the flow of water or to keep out the sea,3.6653,2935
choir,noun,C1,choir.n.01,a chorus that sings as part of a religious ceremony,3.6653,2936
sketch,noun,C1,sketch.n.01,preliminary drawing for later elaboration,3.6653,2937
bush,noun,B2,shrub.n.01,a low woody perennial plant usually having several major stems,3.6649,2938
bush,noun,B2,bush.n.02,a large wilderness area,3.6649,2939
horn,noun,C1,horn.n.02,one of the bony outgrowths on the heads of certain ungulates,3.6649,2940
issue,verb,B2,publish.v.02,prepare and issue for public distribution or sale,3.6645,2941
brand,noun,B1,brand.n.02,a recognizable kind,3.6643,2942
solid,adj,B1,solid.s.01,characterized by good substantial quality,3.6638,2943
indication,noun,B2,indication.n.01,something that serves to indicate or suggest,3.6634,2944
temporarily,adv,B2,temporarily.r.01,for a limited time only; not permanently,3.6634,2945
chunk,noun,C1,ball.n.08,a compact mass,3.6634,2946
drain,verb,C1,drain.v.01,flow off gradually,3.6634,2947
phase,noun,B2,phase.n.02,(physical chemistry) a distinct state of matter in a system; matter that is identical in chemical composition and physical state and separated from other material by the phase boundary,3.6631,2948
rise,verb,A2,rise.v.04,rise up,3.6628,2949
preserve,verb,B2,continue.v.03,keep or maintain in unaltered condition; cause to remain or last,3.6619,2950
professional,noun,B2,professional.n.01,a person engaged in one of the learned professions,3.6619,2951
session,noun,B2,school_term.n.01,the time during which a school holds classes,3.6616,2952
noisy,adj,A2,noisy.a.01,full of or characterized by loud and nonmusical sounds,3.6615,2953
lens,noun,B2,lens.n.01,a transparent optical device used to converge or diverge transmitted light and to form images,3.6615,2954
withdraw,verb,B2,withdraw.v.01,pull back or move away or backward,3.6614,2955
remote,adj,B1,distant.s.05,located far away spatially,3.6612,2956
anchor,noun,B2,anchor.n.01,a mechanical device that prevents a vessel from moving,3.661,2957
guidance,noun,C1,guidance.n.01,something that provides direction or advice as to a decision or course of action,3.6609,2958
click,verb,B1,snap.v.04,move or strike with a noise,3.6596,2959
analyst,noun,B2,analyst.n.01,someone who is skilled at analyzing data,3.6596,2960
foundation,noun,B2,foundation.n.01,the basis on which something is grounded,3.6585,2961
intimate,adj,C1,intimate.s.01,"marked by close acquaintance, association, or familiarity; ;  - V.L. Parrington",3.6583,2962
frustrated,adj,C1,defeated.s.02,disappointingly unsuccessful,3.6577,2963
strict,adj,B2,rigorous.s.01,rigidly accurate; allowing no deviation from a standard,3.6573,2964
humanity,noun,C1,humanness.n.01,the quality of being human,3.6567,2965
humanity,noun,C1,humanity.n.01,the quality of being humane,3.6567,2966
necessarily,adv,B1,inevitably.r.01,in such a manner as could not be otherwise,3.6566,2967
stand,noun,B2,base.n.08,a support or foundation,3.6563,2968
investor,noun,B2,investor.n.01,someone who commits capital in order to gain financial returns,3.6558,2969
asylum,noun,C1,refuge.n.03,a shelter from danger or hardship,3.6558,2970
base,noun,B1,base.n.03,a place that the runner must touch before scoring,3.6544,2971
base,noun,B1,foundation.n.03,lowest support of a structure,3.6544,2972
downtown,adv,A2,downtown.r.01,toward or in the lower or central part of town,3.6539,2973
digital,adj,A2,digital.a.01,displaying numbers rather than scale positions,3.6539,2974
budget,noun,B2,budget.n.02,a summary of intended expenditures along with proposals for how to meet them,3.6539,2975
canal,noun,B2,canal.n.01,(astronomy) an indistinct surface feature of Mars once thought to be a system of channels; they are now believed to be an optical illusion,3.6539,2976
inflict,verb,C1,inflict.v.01,impose something unpleasant,3.6539,2977
corn,noun,B1,corn.n.02,the dried grains or kernels or corn used as animal feed or ground for meal,3.6532,2978
flash,noun,B2,flash.n.01,a sudden intense burst of radiant energy,3.6531,2979
shine,verb,B1,reflect.v.04,be bright by reflecting or casting light,3.653,2980
evacuate,verb,C1,evacuate.v.02,empty completely,3.6529,2981
evacuate,verb,C1,evacuate.v.01,move out of an unsafe location into safety,3.6529,2982
delay,verb,B2,delay.v.01,cause to be slowed down or delayed,3.6528,2983
regular,adj,A2,regular.s.03,conforming to a standard or pattern,3.6525,2984
platform,noun,A2,platform.n.01,a raised horizontal surface,3.6525,2985
discount,noun,B1,discount.n.01,the act of reducing the selling price of merchandise,3.6519,2986
gesture,noun,B2,gesture.n.01,motion of hands or body to emphasize or help to express a thought or feeling,3.6519,2987
supportive,adj,C1,supportive.a.01,furnishing support or assistance,3.6519,2988
abuse,verb,C1,mistreat.v.01,treat badly,3.6515,2989
virtue,noun,C1,virtue.n.01,the quality of doing what is right and avoiding what is wrong,3.6511,2990
charge,verb,B1,tear.v.03,move quickly and violently,3.65,2991
climb,noun,B1,ascent.n.01,an upward slope or grade (as in a road),3.65,2992
considerable,adj,B2,considerable.a.01,large or relatively large in number or amount or extent or degree,3.65,2993
ensure,verb,B2,guarantee.v.02,make certain of,3.6495,2994
appeal,noun,B1,appeal.n.02,attractiveness that interests or pleases or stimulates,3.6488,2995
appeal,noun,B1,appeal.n.03,(law) a legal proceeding in which the appellant resorts to a higher court for the purpose of obtaining a review of a lower court decision and a reversal of the lower court's judgment or the granting of a new trial,3.6488,2996
protest,noun,B1,protest.n.01,a formal and solemn declaration of objection,3.6487,2997
heat,verb,A2,heat.v.01,make hot or hotter,3.648,2998
achievement,noun,B1,accomplishment.n.01,the action of accomplishing something,3.648,2999
fade,verb,C1,fade.v.01,become less clearly visible or distinguishable; disappear gradually or seemingly,3.648,3000
fade,verb,C1,fade.v.02,"lose freshness, vigor, or vitality",3.648,3001
proceeding,noun,C1,proceeding.n.01,(law) the institution of a sequence of steps by which legal judgments are invoked,3.648,3002
spin,noun,C1,spin.n.01,a swift whirling motion (usually of a missile),3.648,3003
regain,verb,C1,recover.v.01,get or find back; recover the use of,3.648,3004
cap,noun,B1,cap.n.02,a top (as for a bottle),3.6475,3005
treasure,noun,B2,gem.n.01,art highly prized for its beauty or perfection,3.6475,3006
motion,noun,B2,motion.n.03,a change of position that does not entail a change of location,3.6469,3007
confront,verb,C1,confront.v.01,"oppose, as in hostility or a competition",3.6467,3008
national,adj,A2,national.a.02,limited to or in the interests of a particular nation,3.6466,3009
release,verb,B1,turn.v.08,let (something) fall or spill from a container,3.6466,3010
decoration,noun,B2,decoration.n.01,something used to beautify,3.6461,3011
trading,noun,B2,trading.n.01,buying or selling securities or commodities,3.6461,3012
unacceptable,adj,B2,unacceptable.s.01,not adequate to give satisfaction,3.6461,3013
diagnosis,noun,C1,diagnosis.n.01,identifying the nature or cause of some phenomenon,3.6461,3014
realm,noun,C1,kingdom.n.01,a domain in which something is dominant,3.6461,3015
function,verb,B2,function.v.01,perform as expected when applied,3.6458,3016
wisdom,noun,B2,wisdom.n.01,accumulated knowledge or erudition or enlightenment,3.6457,3017
cable,noun,B1,cable.n.02,a conductor for transmitting electrical or optical signals or electric power,3.6456,3018
blast,verb,C1,blast.v.01,make a strident sound,3.6451,3019
entrance,noun,B1,entrance.n.02,a movement into or inward,3.6446,3020
plastic,adj,A2,fictile.s.03,capable of being molded or modeled (especially of earth or clay or other soft material),3.6441,3021
confirmation,noun,C1,confirmation.n.01,additional proof that something that was believed (some fact or hypothesis or theory) is correct,3.6441,3022
pledge,noun,C1,pledge.n.01,a deposit of personal property as security for a debt,3.6441,3023
hesitate,verb,B2,hesitate.v.01,pause or hold back in uncertainty or unwillingness,3.6437,3024
defensive,adj,C1,defensive.a.01,intended or appropriate for defending against or deterring aggression or attack,3.6433,3025
severe,adj,B2,severe.s.01,intensely or extremely bad or unpleasant in degree or quality,3.6431,3026
scan,verb,B1,scan.v.02,examine hastily,3.6429,3027
spill,verb,B2,spill.v.01,cause or allow (a liquid substance) to run or flow from a container,3.6428,3028
spill,verb,B2,spill.v.03,cause or allow (a solid substance) to flow or run out or over,3.6428,3029
vague,adj,C1,obscure.s.01,not clearly understood or expressed; ; -Anatole Broyard; - P.A.Sorokin; - John Locke,3.6428,3030
descend,verb,C1,descend.v.01,"move downward and lower, but not necessarily all the way",3.6421,3031
pledge,verb,C1,pledge.v.01,promise solemnly and formally,3.6421,3032
shrink,verb,C1,shrivel.v.01,"wither, as with a loss of moisture",3.6421,3033
remains,noun,C1,remains.n.01,any object that is left unused or still extant,3.6421,3034
exchange,verb,B1,exchange.v.01,"give to, and receive from, one another",3.6415,3035
drawing,noun,A2,drawing.n.01,"an illustration that is drawn by hand and published in a book, magazine, or newspaper",3.6411,3036
soil,noun,B1,dirt.n.02,the state of being covered with unclean things,3.6411,3037
cross,noun,A2,cross.n.01,a wooden structure consisting of an upright post with a transverse piece,3.6401,3038
experiment,verb,B1,experiment.v.01,to conduct a test or investigation,3.6401,3039
bishop,noun,C1,bishop.n.01,a senior member of the Christian clergy having spiritual and administrative authority; appointed in Christian churches to oversee priests or ministers; considered in some churches to be successors of the twelve Apostles of Christ,3.6401,3040
keen,adj,C1,acute.s.03,having or demonstrating ability to recognize or draw fine distinctions,3.6401,3041
rebel,noun,C1,rebel.n.01,`Johnny' was applied as a nickname for Confederate soldiers by the Federal soldiers in the American Civil War; `greyback' derived from their grey Confederate uniforms,3.6397,3042
satisfaction,noun,B2,satisfaction.n.01,"the contentment one feels when one has fulfilled a desire, need, or expectation",3.6394,3043
rally,noun,C1,rally.n.01,a large gathering of people intended to arouse enthusiasm,3.6388,3044
lazy,adj,A2,faineant.s.01,disinclined to work or exertion,3.6385,3045
imaginary,adj,B1,fanciful.s.02,not based on fact; unreal; - F.D.Roosevelt,3.6381,3046
local,noun,B1,local.n.01,public transport consisting of a bus or train that stops at all stations or stops,3.6381,3047
host,verb,B2,host.v.01,be the host of or for,3.6381,3048
equation,noun,C1,equation.n.01,a mathematical statement that two expressions are equal,3.6381,3049
lower,verb,B2,lower.v.01,move something or somebody to a lower position,3.637,3050
twist,verb,C1,writhe.v.01,"to move in a twisting or contorted motion, (especially when struggling)",3.6364,3051
singing,noun,A2,singing.n.01,the act of singing vocal music,3.6361,3052
corrupt,adj,C1,corrupt.a.01,lacking in integrity,3.6361,3053
counseling,noun,C1,guidance.n.01,something that provides direction or advice as to a decision or course of action,3.6361,3054
compel,verb,C1,compel.v.01,force somebody to do something,3.6361,3055
rare,adj,B1,rare.s.03,not widely distributed,3.6357,3056
measure,verb,B1,measure.v.01,"determine the measurements of something or somebody, take measurements of",3.6353,3057
jurisdiction,noun,C1,legal_power.n.01,(law) the right and power to interpret and apply the law,3.6345,3058
category,noun,B1,class.n.01,a collection of things sharing a common attribute,3.6342,3059
immune,adj,B2,immune.a.01,relating to the condition of immunity,3.6341,3060
merger,noun,C1,amalgamation.n.01,the combination of two or more commercial companies,3.6341,3061
noble,adj,C1,noble.a.02,of or belonging to or constituting the hereditary aristocracy especially as derived from feudal times,3.6334,3062
