word,pos,cefr,sense_id,sense_hint,sense_zipf,global_zipf_rank
complex,adj,B1,complex.a.01,complicated in structure; consisting of interconnected parts,4.0884,1377
support,noun,B1,support.n.01,the activity of providing for or maintaining by supplying with money or necessities,4.0878,1378
election,noun,B1,election.n.01,a vote to select the winner of a position or political office,4.0876,1379
print,verb,A2,print.v.01,put into print,4.0874,1380
graduate,verb,B1,graduate.v.01,receive an academic degree upon completion of one's studies,4.0873,1381
technology,noun,B1,technology.n.01,the practical application of science to commerce or industry,4.0872,1382
grant,verb,B2,award.v.02,give as judged due or on the basis of merit,4.0869,1383
scene,noun,A2,scene.n.04,a consecutive series of pictures that constitutes a unit of action in a film,4.0865,1384
patrol,noun,C1,patrol.n.01,a detachment used for security or reconnaissance,4.0865,1385
moral,adj,B2,moral.a.01,concerned with principles of right and wrong or conforming to standards of behavior and character based on those principles,4.0863,1386
lobby,noun,C1,anteroom.n.01,a large entrance or reception room or area,4.0863,1387
extraordinary,adj,B2,extraordinary.a.01,beyond what is ordinary or usual; highly unusual or exceptional or remarkable,4.0861,1388
release,verb,B1,let_go_of.v.01,"release, as from one's grip",4.086,1389
damage,verb,B1,damage.v.01,inflict damage upon,4.0856,1390
helpful,adj,A2,helpful.a.01,providing assistance or serving a useful function,4.0849,1391
slap,verb,C1,slap.v.01,"hit with something flat, like a paddle or the open hand",4.0849,1392
impress,verb,B2,impress.v.02,impress positively,4.0847,1393
concept,noun,B1,concept.n.01,an abstract or general idea inferred or derived from specific instances,4.0841,1394
lead,verb,A2,lead.v.03,tend to or result in,4.083,1395
federal,adj,B1,federal.s.01,national; especially in reference to the government of the United States as distinct from that of its member units,4.0825,1396
ceremony,noun,B1,ceremony.n.01,a formal event performed on a special occasion,4.0823,1397
notify,verb,C1,advise.v.02,inform (somebody) of something,4.082,1398
landing,noun,B2,landing.n.01,an intermediate platform in a staircase,4.0817,1399
await,verb,C1,expect.v.03,look forward to the probable occurrence of,4.0806,1400
record,verb,A2,record.v.01,make a record of; set down in permanent form,4.0801,1401
master,noun,B2,overlord.n.01,a person who has general authority over others,4.0798,1402
tag,noun,B2,tag.n.01,"a label written or printed on paper, cardboard, or plastic that is attached to something to indicate its owner, nature, price, etc.",4.0798,1403
curious,adj,B2,curious.s.01,beyond or deviating from the usual or expected,4.0786,1404
flesh,noun,C1,flesh.n.01,the soft tissue of the body of a vertebrate: mainly muscle tissue and fat,4.0785,1405
beef,noun,A2,beef.n.01,cattle that are reared for their meat,4.0784,1406
chemical,noun,B1,chemical.n.01,material produced by or used in a reaction involving changes in atoms or molecules,4.0784,1407
confused,adj,B1,baffled.s.01,perplexed by many conflicting situations or statements; filled with bewilderment,4.0779,1408
religion,noun,B1,religion.n.01,a strong belief in a supernatural power or powers that control human destiny,4.0776,1409
pipe,noun,B1,pipe.n.02,a long tube made of metal or plastic that is used to carry water or oil or gas etc.,4.0773,1410
pipe,noun,B1,pipe.n.01,a tube with a small bowl at one end; used for smoking tobacco,4.0773,1411
cheer,noun,B2,cheer.n.01,a cry or shout of approval,4.0769,1412
secretary,noun,A2,secretary.n.01,a person who is head of an administrative department of government,4.0766,1413
secretary,noun,A2,secretary.n.02,an assistant who handles correspondence and clerical work for a boss or an organization,4.0766,1414
cabin,noun,B2,cabin.n.01,small room on a ship or boat where people sleep,4.0766,1415
trap,verb,B2,trap.v.01,place in a confining or embarrassing position,4.0762,1416
trailer,noun,C1,dawdler.n.01,someone who takes more time than necessary; someone who lags behind,4.0762,1417
equal,adj,B1,equal.a.01,"having the same quantity, value, or measure as another",4.0755,1418
alike,adv,B2,alike.r.01,equally,4.0755,1419
beloved,adj,C1,beloved.s.01,dearly loved,4.0755,1420
touch,verb,A2,touch.v.02,perceive via the tactile sense,4.0751,1421
fascinating,adj,B1,absorbing.s.01,capable of arousing and holding the attention,4.0747,1422
headache,noun,A2,concern.n.04,something or someone that causes anxiety; a source of unhappiness,4.0744,1423
harm,verb,B2,harm.v.01,cause or do harm to,4.074,1424
wonder,noun,B1,wonder.n.01,the feeling aroused by something strange and surprising,4.0738,1425
weigh,verb,B1,weigh.v.01,have a certain weight,4.0735,1426
control,noun,A2,control.n.03,(physiology) regulation or maintenance of a function or action or reflex etc,4.0733,1427
fee,noun,B2,fee.n.01,a fixed charge for a privilege or for professional services,4.0733,1428
charm,noun,C1,appeal.n.02,attractiveness that interests or pleases or stimulates,4.0733,1429
log,noun,C1,log.n.01,a segment of the trunk of a tree when stripped of branches,4.0733,1430
occasion,noun,B1,juncture.n.01,an event that occurs at a critical time,4.0719,1431
vegetable,noun,A2,vegetable.n.01,edible seeds or roots or stems or leaves or bulbs or tubers or nonsweet fruits of any of numerous herbaceous plant,4.0718,1432
valley,noun,B1,valley.n.01,a long depression in the surface of the land that usually contains a river,4.0718,1433
smell,noun,A2,olfactory_property.n.01,any property detected by the olfactory system,4.0715,1434
tragedy,noun,B2,calamity.n.01,an event resulting in great loss and misfortune,4.0713,1435
hopefully,adv,B2,hopefully.r.01,with hope; in a hopeful manner,4.0711,1436
express,verb,A2,express.v.01,give expression to,4.0706,1437
bite,noun,B1,bite.n.01,a wound resulting from biting by an animal or a person,4.0703,1438
bite,noun,B1,morsel.n.02,a small amount of solid food; a mouthful,4.0703,1439
rape,noun,C1,rape.n.01,Eurasian plant cultivated for its seed and as a forage crop,4.0703,1440
stage,noun,B1,degree.n.02,a specific identifiable position in a continuum or series or especially in a process,4.0699,1441
field,noun,A2,discipline.n.01,a branch of knowledge,4.0698,1442
fantasy,noun,B2,fantasy.n.01,imagination unrestricted by reality,4.0697,1443
interfere,verb,C1,interfere.v.01,come between so as to be hindrance or obstacle,4.0697,1444
loyal,adj,B2,loyal.a.01,steadfast in allegiance or duty,4.0696,1445
proceed,verb,B2,continue.v.02,"continue talking;  he continued,",4.0696,1446
league,noun,B2,league.n.01,an association of sports teams that organizes matches for its members,4.0694,1447
exact,adj,A2,exact.a.01,marked by strict and particular and complete accordance with fact,4.0681,1448
suspicious,adj,C1,leery.s.01,openly distrustful and unwilling to confide,4.0677,1449
prayer,noun,B1,prayer.n.01,the act of communicating with a deity (especially as a petition or in adoration or contrition or thanksgiving),4.067,1450
accept,verb,A2,accept.v.03,give an affirmative reply to; respond favorably to,4.0659,1451
permanent,adj,B2,permanent.a.01,continuing or enduring without marked change in status or condition or place,4.0659,1452
invisible,adj,C1,invisible.a.01,impossible or nearly impossible to see; imperceptible by the eye,4.0659,1453
sight,noun,B1,sight.n.03,the ability to see; the visual faculty,4.0653,1454
combat,noun,C1,combat.n.01,an engagement fought between two military forces,4.0651,1455
attempt,verb,B1,try.v.01,make an effort or attempt,4.065,1456
drive,noun,A2,campaign.n.02,a series of actions advancing a principle or tending toward a particular end,4.0648,1457
pot,noun,B1,pot.n.01,metal or earthenware cooking vessel that is usually round and deep; often has a handle and lid,4.0642,1458
lay,verb,B1,lay.v.02,put in a horizontal position,4.0636,1459
operate,verb,B2,operate.v.01,"direct or control; projects, businesses, etc.",4.0636,1460
relation,noun,B1,relation.n.01,an abstraction belonging to or characteristic of two entities or parts together,4.0634,1461
survive,verb,B2,survive.v.02,"continue in existence after (an adversity, etc.)",4.0628,1462
kick,noun,B1,kick.n.01,the act of delivering a blow with the foot,4.0627,1463
dust,noun,B1,dust.n.01,fine powdery material such as dry earth or pollen that can be blown about in the air,4.0626,1464
nuclear,adj,B1,nuclear.a.01,(weapons) deriving destructive energy from the release of atomic energy,4.0621,1465
visit,noun,A2,visit.n.02,a meeting arranged by the visitor to see someone (such as a doctor or lawyer) for treatment or advice,4.0616,1466
act,noun,B1,act.n.02,something that people do or cause to happen,4.0615,1467
salary,noun,A2,wage.n.01,something that remunerates,4.0613,1468
thinking,noun,B1,thinking.n.01,the process of using your mind to consider something carefully,4.0613,1469
existence,noun,B2,being.n.01,the state or fact of existing,4.0606,1470
excuse,verb,B2,excuse.v.01,accept an excuse for,4.0604,1471
excuse,verb,B2,excuse.v.03,serve as a reason or cause or justification of,4.0604,1472
excuse,verb,B2,excuse.v.02,grant exemption or release to,4.0604,1473
sheet,noun,A2,sheet.n.02,paper used for writing or printing,4.0598,1474
injury,noun,A2,injury.n.01,any physical damage to the body caused by violence or accident or fracture etc.,4.0596,1475
pity,noun,B2,commiseration.n.01,a feeling of sympathy and sorrow for the misfortunes of others,4.0596,1476
reach,verb,A2,reach.v.03,move forward or upward in order to touch; also in a metaphorical sense,4.0591,1477
access,verb,B1,access.v.01,obtain or retrieve from a storage device; as of information on a computer,4.0591,1478
quality,noun,A2,quality.n.01,an essential and distinguishing attribute of something or someone; --Shakespeare,4.059,1479
mask,noun,C1,mask.n.01,a covering to disguise or conceal the face,4.0587,1480
mask,noun,C1,mask.n.02,activity that tries to conceal something,4.0587,1481
politics,noun,B1,politics.n.01,social relations involving intrigue to gain authority or power,4.0581,1482
colleague,noun,A2,colleague.n.01,an associate that one works with,4.0579,1483
account,noun,B1,report.n.03,a short account of the news,4.0579,1484
communication,noun,B1,communication.n.01,the activity of communicating; the activity of conveying information,4.0569,1485
dentist,noun,A2,dentist.n.01,a person qualified to practice dentistry,4.0568,1486
penny,noun,A2,penny.n.01,a fractional monetary unit of Ireland and the United Kingdom; equal to one hundredth of a pound,4.0565,1487
education,noun,A2,education.n.01,the activities of educating or instructing; activities that impart knowledge or skill,4.0558,1488
train,verb,B1,train.v.01,create by training and teaching,4.0554,1489
slip,verb,B2,slip.v.02,insert inconspicuously or quickly or quietly,4.0553,1490
envelope,noun,B2,envelope.n.01,"a flat (usually rectangular) container for a letter, thin package, etc.",4.0553,1491
powder,noun,B1,powder.n.01,a solid substance in the form of tiny loose particles; a solid that has been pulverized,4.055,1492
flee,verb,C1,flee.v.01,run away quickly,4.0545,1493
offense,noun,B2,discourtesy.n.03,a lack of politeness; a failure to show regard for others; wounding the feelings or others,4.0541,1494
territory,noun,C1,district.n.01,a region marked off for administrative or other purposes,4.0541,1495
hunt,verb,B1,hunt.v.01,pursue for food or sport (as of wild animals),4.054,1496
balance,noun,B1,balance.n.01,a state of equilibrium,4.0539,1497
perform,verb,A2,perform.v.01,carry out or perform an action,4.0538,1498
technique,noun,B1,technique.n.01,a practical method or art applied to some particular task,4.0538,1499
talented,adj,B1,talented.a.01,endowed with talent or talents,4.053,1500
witness,noun,B2,witness.n.03,testimony by word or deed to your religious faith,4.0527,1501
minister,noun,B2,curate.n.01,a person authorized to conduct religious worship,4.0522,1502
object,verb,B2,object.v.01,express or raise an objection or protest or criticism or express dissent,4.0522,1503
cheek,noun,B2,cheek.n.01,either side of the face below the eyes,4.0522,1504
explosion,noun,B1,explosion.n.01,a violent release of energy caused by a chemical or nuclear reaction,4.0519,1505
negotiate,verb,B2,negociate.v.06,discuss the terms of an arrangement,4.0514,1506
poetry,noun,B1,poetry.n.01,literature in metrical form,4.0513,1507
stress,noun,B1,stress.n.01,the relative prominence of a syllable or musical note (especially with regard to stress or pitch),4.0512,1508
plant,verb,A2,plant.v.01,"put or set (seeds, seedlings, or plants) into the ground",4.051,1509
obey,verb,B2,obey.v.01,be obedient to,4.0506,1510
pick,noun,B2,choice.n.01,the person or thing chosen or selected,4.0506,1511
light,adj,A2,light.a.05,psychologically light; especially free from sadness or troubles,4.05,1512
light,adj,A2,light.a.03,of the military or industry; using (or being) relatively small or light arms or equipment,4.05,1513
prevent,verb,A2,prevent.v.01,keep from happening or arising; make impossible,4.0493,1514
soccer,noun,A2,soccer.n.01,a football game in which two teams of 11 players try to kick or head a ball into the opponents' goal,4.0491,1515
discover,verb,A2,learn.v.02,"get to know or become aware of, usually accidentally",4.0489,1516
discover,verb,A2,discover.v.03,"make a discovery, make a new finding",4.0489,1517
tissue,noun,B2,tissue.n.01,part of an organism consisting of an aggregate of cells having a similar structure and function,4.0488,1518
walk,noun,A2,base_on_balls.n.01,(baseball) an advance to first base by a batter who receives four balls,4.0484,1519
bargain,noun,B2,bargain.n.01,an agreement between parties (usually arrived at after discussion) fixing obligations of each,4.0483,1520
directly,adv,B1,directly.r.01,without deviation,4.0471,1521
steam,noun,B2,steam.n.01,water at boiling temperature diffused in the atmosphere,4.0468,1522
cast,noun,B1,cast.n.01,the actors in a play,4.0463,1523
adopt,verb,B2,adopt.v.01,"choose and follow; as of theories, ideas, policies, strategies or plans",4.0458,1524
generous,adj,B1,generous.a.01,willing to give and share unstintingly,4.0457,1525
grocery,noun,A2,grocery_store.n.01,a marketplace where groceries are sold,4.0452,1526
slightly,adv,B1,slightly.r.01,to a small degree or extent,4.0452,1527
childhood,noun,B1,childhood.n.01,the time of person's life when they are a child,4.0449,1528
possess,verb,B2,possess.v.01,"have as an attribute, knowledge, or skill",4.0447,1529
wrap,verb,B2,wind.v.03,arrange or or coil around,4.0443,1530
guilt,noun,C1,guilt.n.01,the state of having committed an offense,4.0436,1531
suggest,verb,B1,hint.v.01,drop a hint; intimate by a hint,4.0435,1532
profile,noun,A2,profile.n.01,an analysis (often in graphical form) representing the extent to which something exhibits various characteristics,4.0433,1533
spider,noun,B1,spider.n.01,"predatory arachnid with eight legs, two poison fangs, two feelers, and usually two silk-spinning organs at the back end of the body; they spin silk to make cocoons for eggs or traps for prey",4.0428,1534
injure,verb,B1,injure.v.01,cause injuries or bodily harm to,4.0428,1535
map,verb,B2,map.v.01,make a map of; show or establish the features of details of,4.042,1536
shelter,noun,B2,shelter.n.01,a structure that provides privacy and protection from danger,4.042,1537
verdict,noun,C1,verdict.n.01,(law) the findings of a jury on issues of fact submitted to it for decision; can be used in formulating a judgment,4.042,1538
imagination,noun,B2,imagination.n.01,the formation of a mental image of something that is not perceived as real and is not present to the senses,4.0412,1539
heal,verb,B2,mend.v.02,heal or recover,4.041,1540
reality,noun,B1,reality.n.02,the state of being actual or real,4.0406,1541
grief,noun,C1,grief.n.01,intense sorrow caused by loss of a loved one (especially by death),4.0405,1542
headquarters,noun,B2,headquarters.n.01,(usually plural) the office that serves as the administrative center of an enterprise,4.0403,1543
request,verb,B1,request.v.01,express the need or desire for; ask for,4.0401,1544
explode,verb,B1,explode.v.01,cause to burst with a violent release of energy,4.0392,1545
vehicle,noun,B1,vehicle.n.02,a medium for the expression or achievement of something,4.0389,1546
rise,verb,A2,arise.v.03,rise to one's feet,4.0384,1547
sail,verb,A2,sail.v.01,traverse or travel on (a body of water),4.0382,1548
railroad,noun,A2,railway.n.01,line that is the commercial organization responsible for operating a system of transportation for trains that pull passengers or freight,4.0381,1549
classic,adj,B1,authoritative.s.02,of recognized authority or excellence,4.0381,1550
feather,noun,B2,feather.n.01,the light horny waterproof structure forming the external covering of birds,4.0381,1551
question,verb,A2,interrogate.v.02,pose a series of questions to,4.0375,1552
notice,noun,A2,notice.n.01,"an announcement containing information about an event; ; ; ""a notice of sale",4.0369,1553
credit,noun,A2,credit.n.02,money available for a client to borrow,4.0366,1554
double,verb,A2,double.v.01,increase twofold,4.0365,1555
basket,noun,B2,basket.n.01,a container that is usually woven and has handles,4.0365,1556
patience,noun,B2,patience.n.01,good-natured tolerance of delay or incompetence,4.0365,1557
privilege,noun,C1,privilege.n.01,a special advantage or immunity or benefit not enjoyed by all,4.0358,1558
jam,noun,A2,jam.n.01,preserve of crushed fruit,4.0357,1559
direction,noun,A2,direction.n.02,the spatial relation between something and the course along which it points or moves,4.0357,1560
grave,adj,C1,dangerous.s.02,causing fear or anxiety by threatening great harm,4.0357,1561
grave,adj,C1,grave.s.01,dignified and somber in manner or character and committed to keeping promises,4.0357,1562
lead,verb,A2,lead.v.05,cause to undertake a certain action,4.0347,1563
musical,adj,A2,musical.a.01,characterized by or capable of producing music,4.0345,1564
wing,noun,B1,wing.n.02,one of the horizontal airfoils on either side of the fuselage of an airplane,4.0341,1565
wing,noun,B1,wing.n.01,a movable organ for flying (one of a pair),4.0341,1566
helmet,noun,B2,helmet.n.01,armor plate that protects the head,4.0341,1567
laughter,noun,A2,laugh.n.01,the sound of laughing,4.0333,1568
foreign,adj,A2,foreign.a.01,of concern to or concerning the affairs of other nations (other than your own),4.0331,1569
deeply,adv,B2,profoundly.r.01,to a great depth psychologically,4.0329,1570
horn,noun,C1,horn.n.01,a noisemaker (as at parties or games) that makes a loud noise when you blow through it,4.0329,1571
pay,noun,A2,wage.n.01,something that remunerates,4.0325,1572
instruction,noun,A2,direction.n.06,a message describing how something is to be done,4.0323,1573
brand,noun,B1,trade_name.n.01,a name given to a product or service,4.0323,1574
crash,noun,B2,crash.n.02,a serious accident (usually involving one or more vehicles),4.0321,1575
hockey,noun,A2,field_hockey.n.01,a game resembling ice hockey that is played on an open field; two opposing teams use curved sticks try to drive a ball into the opponents' net,4.0317,1576
deny,verb,B2,deny.v.02,refuse to accept or believe,4.0314,1577
stone,noun,B1,stone.n.02,building material consisting of a piece of rock hewn in a definite shape for a special purpose,4.0312,1578
pad,noun,C1,pad.n.01,a number of sheets of paper fastened together along one edge,4.0308,1579
delighted,adj,B2,delighted.s.01,greatly pleased,4.03,1580
temple,noun,B2,temple.n.01,place of worship consisting of an edifice for the worship of a deity,4.03,1581
encourage,verb,B1,promote.v.01,contribute to the progress or growth of,4.0299,1582
entertainment,noun,B1,entertainment.n.01,an activity that is diverting and that holds the attention,4.0292,1583
alien,noun,B2,foreigner.n.01,a person who comes from a foreign country; someone who does not owe allegiance to your country,4.0292,1584
scene,noun,A2,scene.n.06,a subdivision of an act of a play,4.0286,1585
scene,noun,A2,view.n.02,the visual percept of a region,4.0286,1586
experience,verb,B1,experience.v.01,go or live through,4.0283,1587
dirt,noun,B1,soil.n.02,the part of the earth's surface consisting of humus and disintegrated rock,4.028,1588
dirt,noun,B1,dirt.n.02,the state of being covered with unclean things,4.028,1589
instrument,noun,A2,instrument.n.01,a device that requires skill for proper use,4.0278,1590
recording,noun,A2,recording.n.01,"a signal that encodes something (e.g., picture or sound) that has been recorded",4.0276,1591
leaf,noun,B1,leaf.n.01,the main organ of photosynthesis and transpiration in higher plants,4.0276,1592
actual,adj,B2,actual.a.01,presently existing in fact and not merely potential or possible,4.0274,1593
confidence,noun,B1,assurance.n.01,freedom from doubt; belief in yourself and your abilities,4.0269,1594
impress,verb,B2,affect.v.05,have an emotional or cognitive impact upon,4.0267,1595
connection,noun,B1,connection.n.02,the state of being connected,4.0258,1596
pretend,verb,B1,feign.v.01,make believe with the intent to deceive,4.0257,1597
naked,adj,B2,naked.s.02,having no protecting or concealing cover; - Shakespeare,4.0257,1598
confident,adj,B1,confident.a.01,having or marked by confidence or assurance,4.0251,1599
peaceful,adj,B1,peaceful.a.01,not disturbed by strife or turmoil or war,4.0251,1600
subway,noun,B1,metro.n.01,an electric railway operating below the surface of the ground (usually in a city),4.0243,1601
annoying,adj,B1,annoying.s.01,causing irritation or annoyance,4.0243,1602
clothing,noun,A2,clothing.n.01,a covering designed to be worn on a person's body,4.0235,1603
waiter,noun,A2,waiter.n.01,a person whose occupation is to serve at table (as in a restaurant),4.0235,1604
rear,adj,C1,rear.s.01,located in or toward the back or rear,4.0235,1605
position,noun,A2,position.n.06,a job in an organization,4.0234,1606
consequence,noun,B1,consequence.n.01,a phenomenon that follows and is caused by some previous phenomenon,4.0232,1607
heel,noun,B2,heel.n.01,the bottom of a shoe or boot; the back part of a shoe or boot that touches the ground and provides elevation,4.0232,1608
assault,noun,C1,assault.n.01,close fighting during the culmination of a military attack,4.0232,1609
specifically,adv,B1,specifically.r.01,in distinction from others,4.0227,1610
tradition,noun,B1,tradition.n.01,an inherited pattern of thought or action,4.0222,1611
target,noun,B1,target.n.03,the location of the target that is to be hit,4.0222,1612
performance,noun,B1,performance.n.01,a dramatic or musical entertainment,4.0218,1613
chamber,noun,C1,chamber.n.01,a natural or artificial enclosed space,4.0218,1614
lead,noun,B1,lead.n.01,an advantage held by a competitor in a race,4.0213,1615
relieve,verb,B2,relieve.v.01,"provide physical relief, as from pain",4.0213,1616
confession,noun,C1,confession.n.01,an admission of misdeeds or faults,4.0213,1617
forbid,verb,B2,forbid.v.01,command against,4.021,1618
conclusion,noun,B1,decision.n.02,a position or opinion or judgment reached after consideration,4.0206,1619
direct,adj,A2,direct.a.01,direct in spatial dimensions; proceeding without deviation or interruption; straight and short,4.02,1620
judge,verb,B1,judge.v.01,determine the result of (a competition),4.0191,1621
miserable,adj,B2,miserable.s.01,very unhappy; full of misery,4.0189,1622
field,noun,A2,field.n.01,a piece of land cleared of trees and usually enclosed,4.0186,1623
celebration,noun,B1,celebration.n.01,a joyful occasion for special festivities to mark some happy event,4.0185,1624
photographer,noun,B1,photographer.n.01,someone who takes photographs professionally,4.0185,1625
magnificent,adj,C1,brilliant.s.03,characterized by grandeur,4.0185,1626
slow,verb,B1,decelerate.v.01,lose velocity; move more slowly,4.0183,1627
terrify,verb,C1,terrify.v.01,fill with terror; frighten greatly,4.0177,1628
needle,noun,B1,needle.n.02,a slender pointer for indicating the reading on the scale of a measuring instrument,4.0166,1629
affair,noun,B2,affair.n.02,a usually secretive or illicit sexual relationship,4.0159,1630
starve,verb,B2,starve.v.02,die of food deprivation,4.015,1631
collect,verb,A2,roll_up.v.02,get or gather together,4.0146,1632
kit,noun,B2,kit.n.01,a case for containing a set of articles,4.0143,1633
thick,adj,B1,thick.a.01,not thin; of a specific thickness or of relatively great extent from one surface to the opposite usually in the smallest of the three solid dimensions,4.014,1634
launch,verb,B2,establish.v.01,set up or found,4.0129,1635
comedy,noun,A2,comedy.n.01,light and humorous drama with a happy ending,4.0126,1636
daily,adj,A2,daily.s.01,of or belonging to or occurring every day,4.0126,1637
leak,noun,C1,leak.n.01,an accidental hole that allows something (fluid or light etc.) to enter or escape,4.0126,1638
civil,adj,B1,civil.s.01,applying to ordinary citizens as contrasted with the military,4.0123,1639
poet,noun,B1,poet.n.01,a writer of poems (the term is usually reserved for writers of good poetry),4.0118,1640
authorize,verb,C1,authorize.v.01,grant authorization or clearance for,4.0118,1641
tie,noun,A2,affiliation.n.01,a social or business relationship,4.0114,1642
unit,noun,B1,unit.n.03,an organization regarded as part of a larger social group,4.0111,1643
challenge,noun,B1,challenge.n.01,a demanding or stimulating situation,4.0111,1644
happily,adv,A2,happily.r.01,in a joyous manner,4.0109,1645
rule,verb,B1,govern.v.03,exercise authority over; as of nations,4.0109,1646
value,noun,B1,value.n.02,the quality (positive or negative) that renders something desirable or valuable,4.0107,1647
union,noun,B2,union.n.01,an organization of employees formed to bargain with the employer,4.0103,1648
exact,adj,A2,accurate.s.02,"(of ideas, images, representations, expressions) characterized by perfect conformity to fact or truth ; strictly correct",4.0101,1649
cure,noun,B2,remedy.n.02,a medicine or therapy that cures disease or relieve pain,4.0101,1650
